{
  "as_of": "2026-09-27T09:00:00",
  "locations": [
    {"code": "WZ", "name": "梧州六堡茶产地仓", "kind": "depot"},
    {"code": "PTJ", "name": "平塘江口（西江·运河交汇）", "kind": "lock"},
    {"code": "QZ", "name": "钦州港", "kind": "port"},
    {"code": "GZB", "name": "广州黄埔港", "kind": "port"},
    {"code": "NN", "name": "南宁南铁路中心站", "kind": "station"},
    {"code": "FCG", "name": "防城港", "kind": "port"},
    {"code": "CLP", "name": "越南盖邻港（下龙）", "kind": "port"},
    {"code": "HPH", "name": "越南海防港", "kind": "port"},
    {"code": "HAN", "name": "河内收货人仓库", "kind": "consignee"}
  ],
  "resources": {
    "books": [
      {"code": "SLOT-SEA-GZ-1002", "series": "SLOT-SEA-GZ", "kind": "slot_ship", "mode": "sea", "service": "广州-海防周班", "origin": "GZB", "dest": "HPH", "depart": "2026-10-02T12:00:00", "arrive": "2026-10-05T18:00:00", "capacity_teu": 14, "cutoff_hours": 24},
      {"code": "SLOT-SEA-GZ-1009", "series": "SLOT-SEA-GZ", "kind": "slot_ship", "mode": "sea", "service": "广州-海防周班", "origin": "GZB", "dest": "HPH", "depart": "2026-10-09T12:00:00", "arrive": "2026-10-12T18:00:00", "capacity_teu": 14, "cutoff_hours": 24},

      {"code": "SLOT-SEA-QH-0930", "series": "SLOT-SEA-QH", "kind": "slot_ship", "mode": "sea", "service": "钦州-海防快线", "origin": "QZ", "dest": "HPH", "depart": "2026-09-30T08:00:00", "arrive": "2026-10-01T20:00:00", "capacity_teu": 20, "cutoff_hours": 12},
      {"code": "SLOT-SEA-QH-1006", "series": "SLOT-SEA-QH", "kind": "slot_ship", "mode": "sea", "service": "钦州-海防快线", "origin": "QZ", "dest": "HPH", "depart": "2026-10-06T08:00:00", "arrive": "2026-10-07T20:00:00", "capacity_teu": 12, "cutoff_hours": 12},
      {"code": "SLOT-SEA-QH-1013", "series": "SLOT-SEA-QH", "kind": "slot_ship", "mode": "sea", "service": "钦州-海防快线", "origin": "QZ", "dest": "HPH", "depart": "2026-10-13T08:00:00", "arrive": "2026-10-14T20:00:00", "capacity_teu": 12, "cutoff_hours": 12},

      {"code": "SLOT-SEA-CL-1005", "series": "SLOT-SEA-CL", "kind": "slot_ship", "mode": "sea", "service": "钦州-盖邻支线", "origin": "QZ", "dest": "CLP", "depart": "2026-10-05T06:00:00", "arrive": "2026-10-06T10:00:00", "capacity_teu": 8, "cutoff_hours": 12},

      {"code": "SLOT-SEA-FC-1001", "series": "SLOT-SEA-FC", "kind": "slot_ship", "mode": "sea", "service": "防城-海防班轮", "origin": "FCG", "dest": "HPH", "depart": "2026-10-01T09:00:00", "arrive": "2026-10-02T15:00:00", "capacity_teu": 10, "cutoff_hours": 12},

      {"code": "SLOT-RAIL-WN-0928", "series": "SLOT-RAIL-WN", "kind": "slot_rail", "mode": "rail", "service": "梧州-南宁班列", "origin": "WZ", "dest": "NN", "depart": "2026-09-28T20:00:00", "arrive": "2026-09-29T06:00:00", "capacity_teu": 6, "cutoff_hours": 4},
      {"code": "SLOT-RAIL-WN-0930", "series": "SLOT-RAIL-WN", "kind": "slot_rail", "mode": "rail", "service": "梧州-南宁班列", "origin": "WZ", "dest": "NN", "depart": "2026-09-30T20:00:00", "arrive": "2026-10-01T06:00:00", "capacity_teu": 6, "cutoff_hours": 4},
      {"code": "SLOT-RAIL-NF-0929", "series": "SLOT-RAIL-NF", "kind": "slot_rail", "mode": "rail", "service": "南防铁路班列", "origin": "NN", "dest": "FCG", "depart": "2026-09-29T22:00:00", "arrive": "2026-09-30T08:00:00", "capacity_teu": 6, "cutoff_hours": 4},
      {"code": "SLOT-RAIL-NF-1001", "series": "SLOT-RAIL-NF", "kind": "slot_rail", "mode": "rail", "service": "南防铁路班列", "origin": "NN", "dest": "FCG", "depart": "2026-10-01T22:00:00", "arrive": "2026-10-02T08:00:00", "capacity_teu": 6, "cutoff_hours": 4}
    ],
    "windows": [
      {"code": "LOCK-MD-0927", "series": "LOCK-MD", "kind": "lock", "name": "马道枢纽船闸", "opens": "2026-09-27T06:00:00", "closes": "2026-09-27T18:00:00", "capacity_per_window": 8, "offset_hours": 3},
      {"code": "LOCK-QN-0927", "series": "LOCK-QN", "kind": "lock", "name": "青年枢纽船闸", "opens": "2026-09-27T06:00:00", "closes": "2026-09-27T18:00:00", "capacity_per_window": 8, "offset_hours": 7},
      {"code": "LOCK-QS-0927", "series": "LOCK-QS", "kind": "lock", "name": "企石枢纽船闸", "opens": "2026-09-27T06:00:00", "closes": "2026-09-27T18:00:00", "capacity_per_window": 8, "offset_hours": 11},
      {"code": "LOCK-MD-0928", "series": "LOCK-MD", "kind": "lock", "name": "马道枢纽船闸", "opens": "2026-09-28T06:00:00", "closes": "2026-09-28T18:00:00", "capacity_per_window": 8, "offset_hours": 3},
      {"code": "LOCK-QN-0928", "series": "LOCK-QN", "kind": "lock", "name": "青年枢纽船闸", "opens": "2026-09-28T06:00:00", "closes": "2026-09-28T18:00:00", "capacity_per_window": 8, "offset_hours": 7},
      {"code": "LOCK-QS-0928", "series": "LOCK-QS", "kind": "lock", "name": "企石枢纽船闸", "opens": "2026-09-28T06:00:00", "closes": "2026-09-28T18:00:00", "capacity_per_window": 8, "offset_hours": 11},
      {"code": "LOCK-MD-0930", "series": "LOCK-MD", "kind": "lock", "name": "马道枢纽船闸", "opens": "2026-09-30T06:00:00", "closes": "2026-09-30T18:00:00", "capacity_per_window": 8, "offset_hours": 3},
      {"code": "LOCK-QN-0930", "series": "LOCK-QN", "kind": "lock", "name": "青年枢纽船闸", "opens": "2026-09-30T06:00:00", "closes": "2026-09-30T18:00:00", "capacity_per_window": 8, "offset_hours": 7},
      {"code": "LOCK-QS-0930", "series": "LOCK-QS", "kind": "lock", "name": "企石枢纽船闸", "opens": "2026-09-30T06:00:00", "closes": "2026-09-30T18:00:00", "capacity_per_window": 8, "offset_hours": 11},
      {"code": "LOCK-MD-1001", "series": "LOCK-MD", "kind": "lock", "name": "马道枢纽船闸", "opens": "2026-10-01T06:00:00", "closes": "2026-10-01T18:00:00", "capacity_per_window": 8, "offset_hours": 3},
      {"code": "LOCK-QN-1001", "series": "LOCK-QN", "kind": "lock", "name": "青年枢纽船闸", "opens": "2026-10-01T06:00:00", "closes": "2026-10-01T18:00:00", "capacity_per_window": 8, "offset_hours": 7},
      {"code": "LOCK-QS-1001", "series": "LOCK-QS", "kind": "lock", "name": "企石枢纽船闸", "opens": "2026-10-01T06:00:00", "closes": "2026-10-01T18:00:00", "capacity_per_window": 8, "offset_hours": 11},

      {"code": "QZ-BERTH-0929", "series": "QZ-BERTH", "kind": "port", "name": "钦州港泊位作业窗", "opens": "2026-09-29T06:00:00", "closes": "2026-09-29T22:00:00", "capacity_per_window": 10},
      {"code": "QZ-BERTH-1001", "series": "QZ-BERTH", "kind": "port", "name": "钦州港泊位作业窗", "opens": "2026-10-01T06:00:00", "closes": "2026-10-01T22:00:00", "capacity_per_window": 10},
      {"code": "QZ-BERTH-1002", "series": "QZ-BERTH", "kind": "port", "name": "钦州港泊位作业窗", "opens": "2026-10-02T06:00:00", "closes": "2026-10-02T22:00:00", "capacity_per_window": 10},
      {"code": "QZ-CUS-0929", "series": "QZ-CUS", "kind": "customs", "name": "钦州报关窗（含夜班预约）", "opens": "2026-09-29T09:00:00", "closes": "2026-09-29T22:00:00", "capacity_per_window": 8},
      {"code": "QZ-CUS-1001", "series": "QZ-CUS", "kind": "customs", "name": "钦州报关窗", "opens": "2026-10-01T09:00:00", "closes": "2026-10-01T17:00:00", "capacity_per_window": 8},
      {"code": "QZ-CUS-1002", "series": "QZ-CUS", "kind": "customs", "name": "钦州报关窗", "opens": "2026-10-02T09:00:00", "closes": "2026-10-02T17:00:00", "capacity_per_window": 8},
      {"code": "QZ-CUS-1004", "series": "QZ-CUS", "kind": "customs", "name": "钦州报关窗（改配重报）", "opens": "2026-10-04T09:00:00", "closes": "2026-10-04T17:00:00", "capacity_per_window": 8},

      {"code": "GZB-BERTH-0928", "series": "GZB-BERTH", "kind": "port", "name": "黄埔港泊位作业窗", "opens": "2026-09-28T06:00:00", "closes": "2026-09-28T22:00:00", "capacity_per_window": 12},
      {"code": "GZB-BERTH-1001", "series": "GZB-BERTH", "kind": "port", "name": "黄埔港泊位作业窗", "opens": "2026-10-01T06:00:00", "closes": "2026-10-01T22:00:00", "capacity_per_window": 12},
      {"code": "GZB-CUS-0928", "series": "GZB-CUS", "kind": "customs", "name": "黄埔报关窗", "opens": "2026-09-28T09:00:00", "closes": "2026-09-28T17:00:00", "capacity_per_window": 8},
      {"code": "GZB-CUS-1001", "series": "GZB-CUS", "kind": "customs", "name": "黄埔报关窗", "opens": "2026-10-01T09:00:00", "closes": "2026-10-01T17:00:00", "capacity_per_window": 8},

      {"code": "NN-STATION-0929", "series": "NN-STATION", "kind": "rail", "name": "南宁南场站换装窗", "opens": "2026-09-29T06:30:00", "closes": "2026-09-29T20:00:00", "capacity_per_window": 6},
      {"code": "NN-STATION-1001", "series": "NN-STATION", "kind": "rail", "name": "南宁南场站换装窗", "opens": "2026-10-01T06:30:00", "closes": "2026-10-01T20:00:00", "capacity_per_window": 6},
      {"code": "FCG-BERTH-0930", "series": "FCG-BERTH", "kind": "port", "name": "防城港泊位作业窗", "opens": "2026-09-30T08:00:00", "closes": "2026-09-30T20:00:00", "capacity_per_window": 8},
      {"code": "FCG-BERTH-1002", "series": "FCG-BERTH", "kind": "port", "name": "防城港泊位作业窗", "opens": "2026-10-02T08:00:00", "closes": "2026-10-02T20:00:00", "capacity_per_window": 8},
      {"code": "FCG-CUS-0930", "series": "FCG-CUS", "kind": "customs", "name": "防城报关窗", "opens": "2026-09-30T10:00:00", "closes": "2026-09-30T17:00:00", "capacity_per_window": 8},
      {"code": "FCG-CUS-1002", "series": "FCG-CUS", "kind": "customs", "name": "防城报关窗", "opens": "2026-10-02T10:00:00", "closes": "2026-10-02T17:00:00", "capacity_per_window": 8},

      {"code": "HPH-BERTH-1002", "series": "HPH-BERTH", "kind": "port", "name": "海防港泊位作业窗", "opens": "2026-10-02T06:00:00", "closes": "2026-10-02T22:00:00", "capacity_per_window": 12},
      {"code": "HPH-BERTH-1003", "series": "HPH-BERTH", "kind": "port", "name": "海防港泊位作业窗", "opens": "2026-10-03T06:00:00", "closes": "2026-10-03T22:00:00", "capacity_per_window": 12},
      {"code": "HPH-BERTH-1006", "series": "HPH-BERTH", "kind": "port", "name": "海防港泊位作业窗", "opens": "2026-10-06T06:00:00", "closes": "2026-10-06T22:00:00", "capacity_per_window": 12},
      {"code": "HPH-BERTH-1008", "series": "HPH-BERTH", "kind": "port", "name": "海防港泊位作业窗", "opens": "2026-10-08T06:00:00", "closes": "2026-10-08T22:00:00", "capacity_per_window": 12},
      {"code": "HPH-BERTH-1013", "series": "HPH-BERTH", "kind": "port", "name": "海防港泊位作业窗", "opens": "2026-10-13T06:00:00", "closes": "2026-10-13T22:00:00", "capacity_per_window": 12},